country_code,country_name,anthem_text
kr,"Korea, Republic of","Until that day when the waters of the Eastern Sea run dry
and Mt. Baekdu is worn away, God protect and preserve our nation. Three thousand Li of splendid rivers and mountains, filled with Roses of Sharon; Great Korean people, stay true to the Great Korean way! As the pine atop Mt. Namsan stands firm, as if wrapped in armour, unchanged through wind and frost, so shall our resilient spirit. The Autumn sky is void and vast, high and cloudless; the bright moon is our heart, undivided and true. With this spirit and this mind, give all loyalty, in suffering or in joy, to the love of country."
kw,Kuwait,"Kuwait, Kuwait, Kuwait, My country, In peace live, in dignity, Your face bright, Your face bright, Your face bright with majesty, Kuwait, Kuwait, Kuwait, My country."
ky,Cayman Islands,"O land of soft, fresh breezes And verdant trees so fair, With the Creator’s glory Reflected ev’rywhere, O sea of palest em’rald, Merging to darkest blue, Whene’er my thoughts fly Godward, I always think of you. Dear, verdant island, set in blue Caribbean Sea, I’m coming, coming very soon, O beautious isle, to thee. Although I wandered far, My heart enshrines thee yet. Homeland, fair Cayman Isle, I cannot thee forget. Away from noise of cities, Their fret and carking care, With moonbeams’ soft caresses, Unchecked by garish glare, Thy fruit with rarest juices, Abundant, rich and free, When sweet church bells are chiming, My fond heart yearns for thee. When tired of all excitement And glam’rous worldly care, How sweet thy shores to reach And find a welcome there, And when comes on the season Of peace, goodwill to man, ‘Tis then I love thee best of all, Beloved Isle, Cayman."
kz,Kazakhstan,"Sky of golden sun, Steppe of golden seed, Legend of courage – Take a look at my country! From antiquity Our heroic glory emerged, They did not give up their pride My Kazakh people are strong! : My country, my country, As your flower I will be planted, As your song I will stream, my country! My native land  – My Kazakhstan! The way was opened to posterity I have a vast land. Its unity is proper, I have an independent country. It welcomed the time Like an eternal friend, Our country is happy, Such is our country."
la,Laos (Lao People's Democratic Republic),"For all time the Lao people have glorified their Fatherland, United in heart, spirit and vigour as one. Resolutely and increasing the dignity of the Lao people And proclaiming the right to be their own masters. The Lao people of all origins are equal And will no longer allow imperialists and traitors to harm them. The entire people will safeguard the independence And the freedom of the Lao nation. They are resolved to struggle for victory In order to lead the nation to prosperity."
lb,Lebanon,"All of us! For our Country, for our Flag and Glory! Our valour and our writings are the envy of the ages. Our mountains and our valleys, they bring forth stalwart men. And to Perfection all our efforts we devote. All of us! For our Country, for our Flag and Glory! All of us! For our Country Our Elders and our children, they await our Country’s call, And on the Day of Crisis they are as Lions of the Jungle. The heart of our East is ever Lebanon, May God preserve her until end of time. All of us! For our Country, for our Flag and Glory! All of us! For our Country The Gems of the East are her land and sea. Throughout the world her good deeds flow from pole to pole. And her name is her glory since time began. Immortality’s Symbol–the Cedar–is her Pride. All of us! For our Country, for our Flag and Glory! All of us! For our Country"
lc,Saint Lucia,"Sons and daughters of Saint Lucia Love the land that gave us birth. Land of beaches, hills and valleys, Fairest isle of all the earth. Wheresoever you may roam, Love, oh love, our island home. Gone the days when nations battled For this Helen of the West. Gone the days when strife and discord, Dimmed her children’s toil and rest. Dawns at last a brighter day, Stretches out a glad new way. May the Good Lord bless our island; Guard her sons from woe and harm. May our people, live united, Strong in soul and strong in arm. Justice, truth and charity, Our ideals forever be."
li,Liechtenstein,"High above the young Rhine Lies Liechtenstein, resting On Alpine heights. This beloved homeland, This dear fatherland Was chosen for us by God’s wise hand. This beloved homeland, This dear fatherland Was chosen for us by God’s wise hand. Long live Liechtenstein, Blossoming on the young Rhine, Happy and faithful! Long live the Prince of the Land, Long live our fatherland, United by brotherly bonds and free. Long live the Prince of the Land, Long live our fatherland, United by brotherly bonds and free"
lk,Sri Lanka,
lr,Liberia,"All hail, Liberia, hail! All hail, Liberia, hail! This glorious land of liberty Shall long be ours. Though new her name, Green be her fame, And mighty be her powers, And mighty be her powers, In joy and gladness With our hearts united, We’ll shout the freedom Of a race benighted, Long live Liberia, happy land! A home of glorious liberty, By God’s command! A home of glorious liberty, By God’s command! All hail, Liberia, hail! All hail, Liberia, hail! In union strong success is sure We cannot fail! With God above Our rights to prove We will o’er all prevail, We will o’er all prevail, With heart and hand Our country’s cause defending We’ll meet the foe With valour unpretending. Long live Liberia, happy land! A home of glorious liberty, By God’s command! A home of glorious liberty, By God’s command!"
ls,Lesotho,"Lesotho, land of our Fathers, You are the most beautiful country of all. You give us birth, In you we are reared And you are dear to us. Lord, we ask You to protect Lesotho. Keep us free from conflict and tribulations. Oh, land of mine, Land of our Fathers, May you have peace."
lt,Lithuania,"Lithuania, our homeland, Land of worshiped heroes! Let your sons draw their strength From our past experience. Let your children always follow Only roads of virtue, May your own, mankind’s well-being Be the goals they work for. May the sun above our land Bannish darkening clouds around Light and truth all along Guide our steps forever. May the love of Lithuania Brightly burn in our hearts. For the sake this land Let unity blossom."
lu,Luxembourg,"Where the Alzette flows through the meadows, The Sura breaks through the crags. Where the vine fragrant grows along the Moselle, The sky promises us wine: There lies the land for which we willingly Dare everything down here. Our homeland which we so deeply Carry in our hearts. Our homeland which we so deeply Carry in our hearts. O Thou above, Whose powerful hand Leads the nations through the world, Protect the Luxembourg land From foreign yoke and threat. As children Thou already instilled in us all The spirit of freedom. Let freedom’s sun, which we have known for so long, Shine for evermore. Let freedom’s sun, which we have known for so long, Shine for evermore."
lv,Latvia,"God, bless Latvia, Our dearest fatherland, Do bless Latvia, Oh, do bless it! God, bless Latvia, Our dearest fatherland, Do bless Latvia, Oh, do bless it! Where Latvian daughters bloom, Where Latvian sons sing, Let us dance in happiness there, In our Latvia! Where Latvian daughters bloom, Where Latvian sons sing, Let us dance in happiness there, In our Latvia!"
ly,Libya,"Oh my country! With my struggle and my patience Drive off enemies and mishaps, And survive! Survive all through, we are your ransom Oh Libya! Oh my country! You are the heritage of grandfathers, May God cast off any hand that would harm you Do survive! We are for ever your soldiers, If you survive we care not who perishes. To you we give solemn pledges That we, Oh Libya, will never fail you. We will never go back to fetters, we have been liberated, and we have freed our home country Libya, Libya, Libya. Our grandfathers carried their swords when struggle called on them Carrying the holy Quran in a hand, and the swords in the other They fought till they spread religion, peace and prosperity all over the world Eternity for them They have built the integrity of our country Libya, Libya, Libya. O son of Libya, oh sons of wild lions We are for glory And glory is yours Since we began our struggle, all people were with us May god protect our independence Seek the ultimate heights And be ready for the struggle, our youth Life is a war for the glory of our home land Libya, Libya, Libya."
ma,Morocco,"Fountain of Freedom Source of Light Where sovereignty and safety meet, Safety and sovereignty may you ever combine! You have lived among nations With title sublime, Filling each heart, Sung by each tongue, Your champion has risen And answered your call. For your soul and your body, The victory they have conquered. In my mouth and in my blood Your breezes have stirred both light and fire. Up! my brethren, Strive for the highest. We call to the world That we are here ready. We salute as our emblem God, Homeland, and King."
mc,Monaco,"All the time, over our country, The same flag has been flying in the wind All the time, the colours red and white Have been the symbol of our liberty Great and small have always respected them."
md,"Moldova, Republic of","A treasure is our tongue that surges From deep shadows of the past, Chain of precious stones that scattered All over our ancient land. A burning flame is our tongue Amidst a people waking From a deathly sleep, no warning, Like the brave man of the stories. Our tongue is the greenest leaf Of the everlasting forests, Gentle river Nistru’s ripples Hiding starlight bright and shining. Our tongue is more than holy, Words of homilies of old Wept and sung perpetually In the homesteads of our folks. A treasure will spring up swiftly From deep shadows of the past, Chain of precious stones that scattered All over our ancient land."
me,Montenegro,"O the bright dawn of May O the bright dawn of May Montenegro our mother Montenegro our mother We are sons of your rocks We are sons of your rocks and keepers of your honesty and keepers of your honesty We love you, the rocky hills and their eerie gorges deep that had never to endure the shameful chains of slavery. Montenegro our mother Montenegro our mother O the bright dawn of May O the bright dawn of May Montenegro our mother Montenegro our mother While our unity gives wings to our Lovcen cause it shall brought the pride and glory to our beloved homeland. The river of our waves, that enter the two seas, shall to ocean guide the voice Montenegro is eternal. shall to ocean guide the voice Montenegro is eternal. Montenegro is eternal."
mf,Saint Martin,"Where over the world, say where, You find an island there, So lovely small with nations free With people French and Dutch Though talking English much, As thee Saint Martin in the sea? O sweet Saint Martin’s Land So bright by beach and strand With sailors on the sea and harbors free Where the chains of mountains green Variously in sunshine sheen Oh I love thy Paradise, Nature beauty fairly nice Oh I love thy Paradise, Nature beauty fairly nice How pretty between all green Flamboyants beaming gleam Of flowers red by sunlight set Thy cows and sheep and goats In meadows or on the roads Thy donkeys keen I can’t forget Thy useful birds in white Their morn and evening flight Like aircrafts-wings in unity Their coming down for food Then turning back to roost Bring home to me their harmony Saint Martin I like thy name In which Columbus fame And memories of old are closed For me a great delight Thy Southern Cross the night May God the Lord protect thy coast!"
mg,Madagascar,"Oh, Our beloved fatherland Oh good Madagascar. Our love for you will not leave, For you, for you for ever. Bless you, oh Creator This island of our ancestors To live in peace and joy Hey! We are truly blessed. Oh our beloved fatherland! We wish to serve you with The body and heart, spirit that is ours, You are precious and truly deserving. Oh our beloved fatherland! We wish that you will be blessed, So that the Creator of this world Will be the foundation of your laws."
mh,Marshall Islands,"My island lies o’er the ocean; Like a wreath of flowers upon the sea; With a light of Mekar from far above; Shining with the brilliance of rays of life;. Our Father’s wondrous creation; Bequeathed to us, our Motherland; I’ll never leave my dear home sweet home; God of our forefathers protect and bless forever Marshall Islands."
mk,North Macedonia,"Today over Macedonia A new sun of freedom rises, Macedonians fight For their rights. Macedonians fight For their rights. Now once again flies The flag of the , . Goce Delcev, Pitu Guli, Dame Gruev, Sandanski. The Macedonian woodlands sing brightly New songs, new awakenings. Free Macedonia Lives free. Free Macedonia Lives free."
ml,Mali,"At your call, Mali, So that you may prosper, Faithful to your destiny, We shall all be united, One people, one goal, one faith For a united Africa. If the enemy should show himself Within or without, On the ramparts, We are ready to stand and die. For Africa and for you, Mali, Our banner shall be liberty. For Africa and for you, Mali, Our fight shall be for unity. Oh, Mali of today, Oh, Mali of tomorrow, The fields are flowering with hope And hearts are thrilling with confidence. Stand up, towns and countryside, Stand up, women, stand up young and old, For the Fatherland on the road Towards a radiant future. For the sake of our dignity Let us strengthen our ranks; For the public well-being Let us forge the common good. Together, shoulder to shoulder, Let us work for happiness. The road is hard, very hard, That leads to common happiness. Courage and devotion, Constant vigilance, Courage and devotion, Constant vigilance, Truth from olden times, The truths of every day, Happiness through effort Will build the Mali of tomorrow. Africa is at last arising, Let us greet this new day. Let us greet freedom, Let us march towards unity. Refound dignity Supports our struggle. Faithful to our oath To make a united Africa, Together, arise, my brothers, All to the place where honour calls."
mm,Myanmar,"‘Til the end of the world, Myanmar!, Since she is the true inheritance from our forefathers, we love and value her. ‘Til the end of the world, Myanmar!, Since she is the true inheritance from our forefathers, we love and value her. We will fight and give our lives for the union This is the country and land of our own For her prosperity, we will responsibly shoulder the task, Standing as one in duty to our precious land."
mn,Mongolia,"Our unwavering independent nation All Mongols’ sacred ancestry All world’s good deeds Always stable, forever continue With all honest nations of the world Strengthen our bonds With all our will and strength Let’s develop our beloved Mongolia Our great nation’s symbol blesses The people’s fate supports Our ancestry, culture and language Let’s forever cherish and prosper Bright peoples of brave Mongolia Have freedom and happiness Key to happiness, column for prosperity Our great country prosper"
mo,Macao,
mp,Northern Mariana Islands,
mq,Martinique,
mr,Mauritania,"We will protect your blood, we sacrifice for you. We will paint the entire country with the colour of hope. And when you call, we answer. We’ve taken a vow, we’ve taken an oath to you. We joyfully gift you to the next generation. We will protect your blood, we sacrifice for you. We will paint the entire country with the colour of hope. We will protect your blood, we sacrifice for you. And when you call, we answer."
ms,Montserrat,"Oh Montserrat, proud Motherland Your children raise your standard high. In toil and tears to serve you well The emerald jewel from God’s hand Oh Montserrat, by nature blest To you your children sing Come well or woe, come friend or foe To you your people cling Rise up and make our country great With art and skill and sacrifice With masque and drum we celebrate Triumphant masters of our fate We sing our land in harmony May God be her eternal guard And make Montserrat a house of hope, A haven in the Carib Sea. No fount of sadness overwhelm A people striving under God Their spirits free forevermore"
mt,Malta,"To this sweet land, our mother, to which we owe our name, Guard her, Lord God, like always you have guarded, Remember her, which you have clothed with light. Give, Great God, intellect to whom who governs, Give mercy to the proprietor, and strength to the workman, To let us serve upright, true and faithful, a united people, Maltese, and in peace."
mu,Mauritius,"Glory to thee, Motherland, O motherland of mine. Sweet is thy beauty, Sweet is thy fragrance, Around thee we gather As one people, As one nation, In peace, justice and liberty. Beloved country, may God bless thee For ever and ever."
mv,Maldives,"In National Unity do we salute our Nation. In the National language do we offer our prayers and salute our Nation. We bow in respect to the Emblem of our Nation, And salute the Flag so exalted. We salute the colours of our Flag; Green, Red and White, Which symbolise Victory, Blessing and Success."
mw,Malawi,"O God bless our land of Malawi, Keep it a land of peace. Put down each and every enemy, Hunger, disease, envy. Join together all our hearts as one, That we be free from fear. Bless our leader, each and every one, And Mother Malawi. Our own Malawi, this land so fair, Fertile and brave and free. With its lakes, refreshing mountain air, How greatly blest are we. Hills and valleys, soil so rich and rare Give us a bounty free. Wood and forest, plains so broad and fair, All – beauteous Malawi. Freedom ever, let us all unite To build up Malawi. With our love, our zeal and loyalty, Bringing our best to her. In time of war, or in time of peace, One purpose and one goal. Men and women serving selflessly In building Malawi."
mx,Mexico,": Mexicans, at the cry of war, Grasp the steel and the bridle, And let the earth’s core tremble To the roar of the cannon. O Homeland! may your brow be wreathed with the olive By the divine archangel of Peace For in heaven, your eternal destiny Has been written by the finger of God. But if a foreign enemy should dare To profane your ground with his step, Think, o beloved Homeland! that heaven Gave you a soldier in each son. War, war without truce upon him who means To sully the blazon of the Homeland; War, war! Soak our homeland’s flags In the waves of blood. War, war! In the mountains and the valley, The dreadful cannons thunder, And the deafening echoes resound The cries of Union! Liberty! O Homeland, before your unarmed sons Bend their necks under the yoke, Your countrysides will be watered with blood And in blood will be their footprints. And your temples, palaces, and towers Will fall with terrible thunder, And their ruins shall live to say, “This was the fatherland of a thousand heroes.” Homeland, Homeland! Your sons swear To breathe out their breath on your altars, If the clarion with its warlike tone Calls them to struggle with valour. For you the garlands of olive! For them a memory of glory! For you a laurel of victory! For them a tomb of honour!"
my,Malaysia,"My country, my native land. The people living united and progressive, May God bestow blessing and happiness. May our Ruler have a successful reign. May God bestow blessing and happiness. May our Ruler have a successful reign."
mz,Mozambique,"In the memory of Africa and the World Beautiful fatherland of that they had dared to fight Mozambique, your name is Freedom The Sun of June forever will shine Mozambique, our Glorious Land Rock by rock constructing the new day Millions of arms in one only force O Loved fatherland we go to be successful Mozambique, our Glorious Land Rock by rock constructing the new day Millions of arms in one only force O Loved fatherland we go to be successful Joined people from Rovuma to Maputo It harvests the fruits of the combat for the Peace The dream grows waving in the flag It goes cultivating in the certainty of tomorrow Flowers sprouting of the soil of your sweat For mounts, the rivers, the sea We swear for you, O Mozambique No tyrant in will go them to enslave"
na,Namibia,Namibia land of the brave Freedom’s fight we have won Glory to their bravery Whose blood waters our freedom We give our love and loyalty Together in unity Contrasting beautiful Namibia Namibia our country Beloved land of savannahs Hold high the banner of liberty : Namibia our country Namibia motherland We love thee.
nc,New Caledonia,
ne,Niger,"From the shores of the Niger to the edges of the Ténéré Brothers and sisters we are Children of a same fatherland Niger Fed of the sap of the same ideals For a Niger of peace, free, strong, and united For a prosperous Niger, the country of our dreams For the honor of the fatherland Let us incarnate the valiance and the perseverance And all the virtues of our worthy forefathers Intrepid, determined and proud warriors Let us defend the homeland at the price of our blood Let us make Niger the symbol of dignity The emblem and torch of Africa advancing For these noble ideals, arise and go forward Forward for work and forward for the fight We remain standing Holding high the flag of our dear country In the sky of Africa and in the whole universe To construct together A world of justice, peace and progress And to make Niger the pride of Africa"
nf,Norfolk Island,"Come ye blessed of my Father Inherit the kingdom prepared for you From the foundation of the world I was hunger’d and ye gave me meat, I was thirsty and ye gave me drink I was a stranger and ye took me in, Naked and ye clothed me, I was sick and ye visited me, I was in prison and ye came unto me In as much ye have done it unto one of the least of These my brethren Ye have done it unto me, Ye have done it unto me."
ng,Nigeria,"Nigeria we hail thee, Our own dear native land, Though tribe and tongue may differ, In brotherhood we stand, Nigerians all, are proud to serve Our sovereign Motherland. Our flag shall be a symbol That truth and justice reign, In peace or battle honour’d, And this we count as gain, To hand on to our children A banner without stain. O God of all creation, Grant this our one request, Help us to build a nation Where no man is oppressed, And so with peace and plenty Nigeria may be blessed."
ni,Nicaragua,"Hail to thee, Nicaragua.  In your land The cannon’s voice no longer roars, Nor does the blood of our brothers Stain your glorious bicoloured flag. Nor does the blood of our brothers Stain your glorious bicoloured flag. Peace shines in beauty in your skies, Nothing dims your immortal glory, For work is what earns your laurels And honour is your triumphal ensign, Is your triumphal ensign."
nl,Netherlands,
no,Norway,"Yes, we love this country as it rises forth, rugged, weathered, above the sea, with the thousands of homes. Love, love it and think of our father and mother and the saga night that sends dreams to our earth. and the saga night that sends sends dreams to our earth. This country Harald united with his army of heroes, this country Håkon protected whilst Øyvind sung; upon the country Olav painted with his blood the cross, from its heights Sverre spoke up against Rome. from its heights Sverre spoke spoke up against Rome. Farmers their axes sharpened wherever an army advanced, Tordenskiold along the coastline thundered so that we could see it back home. Even women stood up and fought as if they were men; others could only cry but that soon would end! others could only cry but that soon, that soon would end! Sure, we were not many but we were enough, when we were tested sometimes, and it was at stake; we would rather burn our land than to declare defeat; just remember what happened down at Fredrikshald! just remember what happened what happened down at Fredrikshald! Hard times we have coped with, were at last disowned; but in the worst distress, blue-eyed freedom was to us born. It gave (us) father’s strength to carry famine and war, it gave death itself its honour – and it gave reconciliation. it gave death itself its honour – and it gave, it gave reconciliation. The enemy threw away his weapon, up the visor went, we, in wonder, to him hastened, because he was our brother. Driven forth to a stand by shame we went to the south; now we three brothers stand united, and shall stand like that! now we three brothers stand united, united, and shall stand like that! Norseman in house and cabin, thank your great God! The country he wanted to protect, although things looked dark. All the fights fathers have fought, and the mothers have wept, the Lord has quietly moved so we won our rights. the Lord has quietly moved so we won, we won our rights. Yes, we love this country as it rises forth, rugged, weathered, above the sea, with those thousand homes. And as the fathers’ struggle has raised it from need to victory, even we, when it is demanded, for its peace, its peace will encamp"
np,Nepal,"We are hundreds of flowers, the one garland – Nepali Sovereign, spread out from Mechi to Mahakali. We are hundreds of flowers, the one garland – Nepali Sovereign, spread out from Mechi to Mahakali. Amassing nature’s millions of heritage By the blood of the braves, independent and immovable. Land of knowledge, land of peace, Terai hills, mountains Undivided this beloved, our motherland Nepal. Diverse race, language, religion, culture are so large Our progressive nation, long live, long live Nepal."
nr,Nauru,"Nauru our homeland, the land we dearly love, We all pray for you and we also praise your name. Since long ago you have been the home of our great forefathers And will be for generations yet to come. We all join in together to honour your flag, And we shall rejoice together and say; Nauru for evermore!"
